midas_id,cla_gr_uid,title
agl_et,566,"ALGAO Event Types"
dob_98,,"Defence of Britain Thesaurus"
eh_com,546,"English Heritage Components Thesaurus"
eh_evd,92,"Evidence Thesaurus"
eh_hat,225,"English Heritage Historic Aircraft Type Thesaurus"
eh_tbm,129,"RCHME Thesaurus of Building Materials"
eh_time,486,"English Heritage Timelines Thesaurus"
eh_tmc,143,"Thesaurus of Maritime Craft Types"
eh_tmt2,1,"English Heritage Thesaurus of Monument Types 2nd Edition"
mda_obj,128,"mda Archaeological Object Thesaurus"
thred,,"Thesaurus of Resource Description"
eh_car,77,"English Heritage Cargo Thesaurus"
eh_mpn,145,"English Heritage Maritime Placenames Thesaurus"
eh_role,,"English Heritage Heritage Roles list"
eh_nat,,"English Heritage Historic Craft Nationality list"
eh_cdp98,,"EH County District, Parish list. Includes Unitary Authorities and Non Parish Areas"
os_100km,,"Ordnance Survey 100 km square letters list"
rc_period,,"RCHME Cultural Periods list"

